_id,category,name,description,price,image,gender,isDeleted,updatedAt,createdAt,__v,image.asset_id,image.public_id,image.version,image.version_id,image.signature,image.width,image.height,image.format,image.resource_type,image.created_at,image.bytes,image.type,image.etag,image.placeholder,image.url,image.secure_url,image.folder,image.access_mode,image.original_filename,image.api_key
64d45cd5bcde2e7209111377,shoes,Electronic Frozen Chicken,Earum possimus eius dolor. Deserunt sint dicta nam repellat consequuntur ullam ab aspernatur.,189.79,https://loremflickr.com/640/480/fashion?lock=249278012325888,male,false,,,,,,,,,,,,,,,,,,,,,,,
64d45cd5bcde2e7209111378,pants,Modern Steel Pants,Alias perspiciatis amet quos.,198.18,https://loremflickr.com/640/480/fashion?lock=1890460584902656,female,false,,,,,,,,,,,,,,,,,,,,,,,
64d45cd5bcde2e7209111379,shoes,Gorgeous Steel Hat,Tempora nobis dicta officia omnis ab illo. Eveniet cumque veritatis natus. Modi voluptates dolor velit cumque ratione blanditiis odit.,126.32,https://loremflickr.com/640/480/fashion?lock=2998745482395648,female,false,,,,,,,,,,,,,,,,,,,,,,,
64d45cd5bcde2e720911137a,pants,Intelligent Concrete Hat,Hic repellendus nisi. Inventore quae beatae quas iste.,184.84,https://loremflickr.com/640/480/fashion?lock=6742788108451840,female,false,,,,,,,,,,,,,,,,,,,,,,,
64d45cd5bcde2e720911137b,shoes,Handmade Bronze Computer,Modi necessitatibus sit quam. Dolorum soluta soluta nostrum quae.,161.51,https://loremflickr.com/640/480/fashion?lock=7398589200334848,female,false,,,,,,,,,,,,,,,,,,,,,,,
64d45cd5bcde2e720911137c,shirt,Refined Rubber Sausages,Perspiciatis expedita consectetur consequuntur quos quasi. Incidunt velit autem beatae iste culpa autem.,109.53,https://loremflickr.com/640/480/fashion?lock=1949838400815104,male,false,,,,,,,,,,,,,,,,,,,,,,,
64d45cd5bcde2e720911137d,pants,Oriental Plastic Shirt,Commodi consectetur laborum odit debitis veritatis. Accusantium consectetur sunt reiciendis. Magnam totam repudiandae cupiditate ipsam.,194.18,https://loremflickr.com/640/480/fashion?lock=5527007253233664,male,false,,,,,,,,,,,,,,,,,,,,,,,
64d45cd5bcde2e720911137e,shirt,Oriental Frozen Towels,Maxime doloribus suscipit temporibus perspiciatis nihil quis ipsam numquam. Non magni est velit laboriosam natus.,176.55,https://loremflickr.com/640/480/fashion?lock=3014111440928768,female,false,,,,,,,,,,,,,,,,,,,,,,,
64d45cd5bcde2e720911137f,shirt,Oriental Granite Bacon,Veniam debitis architecto deleniti fugiat nobis dicta. Alias maiores ipsam fugiat animi velit perferendis voluptas. Accusamus sequi exercitationem magnam eaque quaerat dicta totam.,107.6,https://loremflickr.com/640/480/fashion?lock=4188625482809344,female,false,,,,,,,,,,,,,,,,,,,,,,,
64d45cd5bcde2e7209111380,pants,Unbranded Steel Towels,Eaque nobis eligendi maiores hic mollitia. Nulla aliquid eligendi in omnis officiis vel aut.,124.11,https://loremflickr.com/640/480/fashion?lock=828128649805824,male,false,,,,,,,,,,,,,,,,,,,,,,,
64d45cd5bcde2e7209111381,pants,Luxurious Cotton Table,Ea quibusdam cupiditate doloremque quos autem autem. Quos nulla occaecati. Fugit earum ducimus vitae atque reprehenderit alias deserunt quam.,182.53,https://loremflickr.com/640/480/fashion?lock=354383451652096,male,false,,,,,,,,,,,,,,,,,,,,,,,
64d45cd5bcde2e7209111382,shoes,Ergonomic Granite Chair,Quia exercitationem maiores.,142.64,https://loremflickr.com/640/480/fashion?lock=3770349185400832,male,false,,,,,,,,,,,,,,,,,,,,,,,
64d45cd5bcde2e7209111383,shoes,Refined Rubber Mouse,Minima quaerat atque accusamus. Optio illo soluta accusamus exercitationem cupiditate alias cumque pariatur.,186.7,https://loremflickr.com/640/480/fashion?lock=5210061668352,male,false,,,,,,,,,,,,,,,,,,,,,,,
64d45cd5bcde2e7209111384,pants,Incredible Fresh Bike,Asperiores consequatur accusamus distinctio sit minus voluptatem.,134.04,https://loremflickr.com/640/480/fashion?lock=4918816370851840,female,false,,,,,,,,,,,,,,,,,,,,,,,
64d45cd5bcde2e7209111385,shirt,Oriental Plastic Tuna,Dolorem quos ea aliquam rerum commodi aperiam optio quasi perferendis.,199.79,https://loremflickr.com/640/480/fashion?lock=2851952054501376,female,false,,,,,,,,,,,,,,,,,,,,,,,
64d45cd5bcde2e7209111386,pants,Intelligent Metal Salad,Labore dolorum dolorum est sed dolor sequi natus fugit. Blanditiis illum odio omnis minus nihil iste impedit enim at. Illo omnis libero rerum voluptate occaecati laboriosam impedit dolores aut.,153.7,https://loremflickr.com/640/480/fashion?lock=4310380524339200,male,false,,,,,,,,,,,,,,,,,,,,,,,
64d45cd5bcde2e7209111387,shirt,Small Rubber Sausages,Aliquam iste repudiandae repudiandae expedita doloribus recusandae.,156.27,https://loremflickr.com/640/480/fashion?lock=5110986092576768,male,false,,,,,,,,,,,,,,,,,,,,,,,
64d45cd5bcde2e7209111388,shirt,Tasty Wooden Towels,Cupiditate exercitationem dicta inventore delectus vitae.,141.5,https://loremflickr.com/640/480/fashion?lock=1537117475831808,male,false,,,,,,,,,,,,,,,,,,,,,,,
64d45cd5bcde2e7209111389,pants,Refined Cotton Chicken,Iure impedit explicabo minus voluptatum voluptate omnis architecto esse maxime.,121.71,https://loremflickr.com/640/480/fashion?lock=2210949882707968,male,false,,,,,,,,,,,,,,,,,,,,,,,
64d45cd5bcde2e720911138a,shoes,Handcrafted Frozen Chicken,Possimus impedit ab aperiam architecto illo non nisi culpa alias. Maiores eligendi nihil consectetur minus.,145.21,https://loremflickr.com/640/480/fashion?lock=7915683851534336,female,false,,,,,,,,,,,,,,,,,,,,,,,
64d45cd5bcde2e720911138b,pants,Handmade Fresh Car,Provident ea placeat aliquid explicabo. Consequatur fugiat cum velit.,128.97,https://loremflickr.com/640/480/fashion?lock=4785335433166848,male,false,,,,,,,,,,,,,,,,,,,,,,,
64d45cd5bcde2e720911138c,shoes,Electronic Rubber Hat,Soluta itaque iusto ipsum quidem dolorem nemo sequi molestiae. Cum ipsam ratione quaerat reiciendis tenetur delectus dolorem eligendi. Maxime magni odio quisquam.,105.66,https://loremflickr.com/640/480/fashion?lock=7735862808805376,male,false,,,,,,,,,,,,,,,,,,,,,,,
64d45cd5bcde2e720911138d,shirt,Luxurious Rubber Shirt,Fuga sunt pariatur magni consectetur. Id totam tempore occaecati. Exercitationem blanditiis in voluptatibus vero accusamus sunt labore temporibus.,170.08,https://loremflickr.com/640/480/fashion?lock=5884782137311232,female,false,,,,,,,,,,,,,,,,,,,,,,,
64d45cd5bcde2e720911138e,shirt,Oriental Bronze Sausages,Facilis inventore nemo quaerat ipsam repudiandae ut et quam. Quibusdam illo ad corporis maiores quis delectus nesciunt sequi.,118.13,https://loremflickr.com/640/480/fashion?lock=2412979955957760,male,false,,,,,,,,,,,,,,,,,,,,,,,
64d45cd5bcde2e720911138f,shoes,Tasty Metal Chair,Dolore quia minima possimus. Sapiente provident dolorum vitae neque odit reprehenderit et. Earum illum sed.,163.86,https://loremflickr.com/640/480/fashion?lock=5188867395158016,female,false,,,,,,,,,,,,,,,,,,,,,,,
64d45cd5bcde2e7209111390,shoes,Refined Steel Sausages,Blanditiis doloribus harum quos.,187.38,https://loremflickr.com/640/480/fashion?lock=7525906918670336,female,false,,,,,,,,,,,,,,,,,,,,,,,
64d45cd5bcde2e7209111391,shirt,Luxurious Cotton Computer,Quos esse nostrum rerum veritatis deleniti ea error. Laudantium consectetur id illo est omnis ipsam consectetur molestiae nam.,102.67,https://loremflickr.com/640/480/fashion?lock=5643041811464192,female,false,,,,,,,,,,,,,,,,,,,,,,,
64d45cd5bcde2e7209111392,shirt,Handcrafted Granite Fish,Ratione perferendis cumque iste illum eos asperiores a harum. Dicta laudantium consequuntur vel odit hic illo distinctio. Occaecati quo iste quae similique delectus.,192.64,https://loremflickr.com/640/480/fashion?lock=6238249781559296,male,false,,,,,,,,,,,,,,,,,,,,,,,
64d45cd5bcde2e7209111393,shirt,Licensed Granite Bacon,Unde ad tempore voluptatem. Libero fuga ea quo assumenda odit dolorem. Hic reiciendis doloremque perspiciatis dignissimos.,131.38,https://loremflickr.com/640/480/fashion?lock=5336841003728896,female,false,,,,,,,,,,,,,,,,,,,,,,,
64d45cd5bcde2e7209111394,shoes,Licensed Frozen Sausages,Asperiores earum consequuntur tenetur neque aut occaecati ab. Quos possimus doloribus adipisci rerum rem quaerat. Dolore aperiam vitae repellendus eveniet nisi iste.,195.89,https://loremflickr.com/640/480/fashion?lock=2200037178212352,female,false,,,,,,,,,,,,,,,,,,,,,,,
64d45cd5bcde2e7209111395,shirt,Licensed Bronze Soap,Minus ipsum ad tempora.,158.41,https://loremflickr.com/640/480/fashion?lock=4474310259376128,female,false,,,,,,,,,,,,,,,,,,,,,,,
64d45cd5bcde2e7209111396,shirt,Refined Bronze Keyboard,Nulla perspiciatis itaque asperiores quibusdam minus officiis cupiditate pariatur. Voluptates laboriosam ducimus voluptas tempore perspiciatis a minus cum assumenda. Perspiciatis ipsa at deleniti incidunt quia occaecati enim.,163.07,https://loremflickr.com/640/480/fashion?lock=1830876230975488,female,false,,,,,,,,,,,,,,,,,,,,,,,
64d45cd5bcde2e7209111397,shirt,Recycled Wooden Shirt,Unde odit sequi incidunt itaque laudantium.,150.8,https://loremflickr.com/640/480/fashion?lock=4630851948118016,female,false,,,,,,,,,,,,,,,,,,,,,,,
64d45cd5bcde2e7209111398,pants,Licensed Wooden Shoes,Earum assumenda deserunt.,191.56,https://loremflickr.com/640/480/fashion?lock=6470262249750528,female,false,,,,,,,,,,,,,,,,,,,,,,,
64d45cd5bcde2e7209111399,pants,Fantastic Concrete Soap,Consectetur porro debitis repellat tempore blanditiis delectus. Distinctio vero id.,178.74,https://loremflickr.com/640/480/fashion?lock=8173766655868928,male,false,,,,,,,,,,,,,,,,,,,,,,,
64d45cd5bcde2e720911139a,shirt,Generic Frozen Keyboard,Velit possimus tenetur minus mollitia voluptatibus quam tempore. Voluptatum voluptatem id omnis. Magnam tempore magnam vitae officiis quidem soluta tenetur in.,184.48,https://loremflickr.com/640/480/fashion?lock=4920950243983360,male,false,,,,,,,,,,,,,,,,,,,,,,,
64d45cd5bcde2e720911139b,shirt,Handmade Plastic Ball,Provident molestias dignissimos ducimus magnam unde. Vero dolorem nisi voluptates accusamus perferendis modi qui. Quo beatae pariatur ad dolores quis eum nihil vel.,158.69,https://loremflickr.com/640/480/fashion?lock=3531445557526528,male,false,,,,,,,,,,,,,,,,,,,,,,,
64d45cd5bcde2e720911139c,shirt,Modern Metal Keyboard,Id id vitae dolorum sunt a suscipit eaque nihil aspernatur.,145.13,https://loremflickr.com/640/480/fashion?lock=5363634112823296,female,false,,,,,,,,,,,,,,,,,,,,,,,
64d45cd5bcde2e720911139d,pants,Practical Granite Shirt,Beatae perspiciatis dicta repellat fuga cupiditate voluptatum. Asperiores officiis voluptatibus. Delectus nobis incidunt laudantium enim.,161.95,https://loremflickr.com/640/480/fashion?lock=2674825401204736,female,false,,,,,,,,,,,,,,,,,,,,,,,
64d45cd5bcde2e720911139e,shoes,Awesome Rubber Cheese,Assumenda unde maiores deserunt sed delectus dignissimos cupiditate soluta quaerat.,166.19,https://loremflickr.com/640/480/fashion?lock=195507200720896,male,false,,,,,,,,,,,,,,,,,,,,,,,
64d45cd5bcde2e720911139f,shirt,Rustic Fresh Computer,Ullam minus sapiente incidunt fuga repudiandae. Aliquid recusandae excepturi architecto facilis in. Natus corporis temporibus quos voluptatem.,105.64,https://loremflickr.com/640/480/fashion?lock=19743310348288,female,false,,,,,,,,,,,,,,,,,,,,,,,
64d45cd5bcde2e72091113a0,pants,Handcrafted Fresh Table,Repellendus eos voluptas ratione magnam rerum animi tempora vitae. Pariatur repudiandae incidunt libero saepe officia atque consequatur.,109.66,https://loremflickr.com/640/480/fashion?lock=4271124166737920,male,false,,,,,,,,,,,,,,,,,,,,,,,
64d45cd5bcde2e72091113a1,shirt,Small Cotton Cheese,Laboriosam deleniti nisi assumenda tempore reiciendis facilis aperiam. Hic aperiam sit. Iste rem eos explicabo quas quidem velit debitis.,180.59,https://loremflickr.com/640/480/fashion?lock=905838029963264,female,false,,,,,,,,,,,,,,,,,,,,,,,
64d45cd5bcde2e72091113a2,shirt,Unbranded Metal Bike,Eligendi tenetur quae dolor.,131.96,https://loremflickr.com/640/480/fashion?lock=5427458710962176,male,false,,,,,,,,,,,,,,,,,,,,,,,
64d45cd5bcde2e72091113a3,shirt,Oriental Bronze Pizza,Possimus totam numquam placeat doloremque sit reiciendis atque praesentium inventore.,142.75,https://loremflickr.com/640/480/fashion?lock=8934978706472960,female,false,,,,,,,,,,,,,,,,,,,,,,,
64d45cd5bcde2e72091113a4,shirt,Awesome Bronze Cheese,Quis cupiditate recusandae quo dolorem vel saepe.,124.42,https://loremflickr.com/640/480/fashion?lock=2010682157432832,male,false,,,,,,,,,,,,,,,,,,,,,,,
64d45cd5bcde2e72091113a5,pants,Unbranded Soft Fish,Perspiciatis dolorum consectetur animi magni magnam quis. Dolore non sint amet reprehenderit quaerat deleniti maiores explicabo veritatis.,176.88,https://loremflickr.com/640/480/fashion?lock=4916495341584384,female,false,,,,,,,,,,,,,,,,,,,,,,,
64d45cd5bcde2e72091113a6,pants,Generic Bronze Gloves,Possimus officiis veritatis et magni accusamus eos ipsum ipsum. Repudiandae quisquam earum. Adipisci commodi repellendus harum.,118.59,https://loremflickr.com/640/480/fashion?lock=5469966283309056,male,false,,,,,,,,,,,,,,,,,,,,,,,
64d45cd5bcde2e72091113a7,shoes,Unbranded Cotton Fish,Adipisci debitis perspiciatis tempore placeat possimus sed.,161.34,https://loremflickr.com/640/480/fashion?lock=6902408923840512,female,false,,,,,,,,,,,,,,,,,,,,,,,
64d45cd5bcde2e72091113a8,shirt,Electronic Rubber Shirt,Quod sed quas inventore fuga neque doloribus animi eligendi vitae. Magnam optio vitae.,183.8,https://loremflickr.com/640/480/fashion?lock=2359680078708736,male,false,,,,,,,,,,,,,,,,,,,,,,,
64d45cd5bcde2e72091113a9,pants,Practical Rubber Chicken,Sed commodi adipisci recusandae labore consequuntur qui facilis officia ducimus. Id sapiente cumque recusandae consequatur.,108.3,https://loremflickr.com/640/480/fashion?lock=7337239346413568,male,false,,,,,,,,,,,,,,,,,,,,,,,
64d45cd5bcde2e72091113aa,shoes,Electronic Plastic Shirt,Debitis eum ullam ipsa.,161.42,https://loremflickr.com/640/480/fashion?lock=6142222332329984,female,false,,,,,,,,,,,,,,,,,,,,,,,
64d45cd5bcde2e72091113ab,pants,Elegant Bronze Pizza,Culpa blanditiis expedita voluptas a dolorum. Inventore vero beatae nobis quae saepe asperiores aliquam autem. Praesentium libero doloribus voluptas ipsa.,154.43,https://loremflickr.com/640/480/fashion?lock=7140062152097792,male,false,,,,,,,,,,,,,,,,,,,,,,,
64d45cd5bcde2e72091113ac,shirt,Elegant Wooden Bacon,Aspernatur minus maxime asperiores reprehenderit hic ratione molestias voluptatem nobis. Sed quae delectus aliquid.,193.12,https://loremflickr.com/640/480/fashion?lock=4839050192093184,male,false,,,,,,,,,,,,,,,,,,,,,,,
64d45cd5bcde2e72091113ad,pants,Electronic Wooden Shirt,Voluptate illum aut pariatur explicabo.,133.87,https://loremflickr.com/640/480/fashion?lock=3187548677472256,female,false,,,,,,,,,,,,,,,,,,,,,,,
64d45cd5bcde2e72091113ae,pants,Bespoke Bronze Gloves,Quod quaerat quos vel ipsa deserunt ipsum quod. Inventore neque ipsa.,110.76,https://loremflickr.com/640/480/fashion?lock=2702836102070272,female,false,,,,,,,,,,,,,,,,,,,,,,,
64d45cd5bcde2e72091113af,shirt,Electronic Cotton Soap,Commodi optio corporis tempore consequatur architecto ipsum esse accusamus. Placeat iste labore ad eveniet aspernatur. Laboriosam accusantium quis voluptatibus quo.,180.37,https://loremflickr.com/640/480/fashion?lock=3523577699631104,male,false,,,,,,,,,,,,,,,,,,,,,,,
64d45cd5bcde2e72091113b0,shirt,Gorgeous Plastic Hat,Repellendus laborum cupiditate dolor et expedita. Eos a error excepturi ipsam facilis nihil blanditiis.,167.15,https://loremflickr.com/640/480/fashion?lock=8526414743601152,male,false,,,,,,,,,,,,,,,,,,,,,,,
64d45cd5bcde2e72091113b1,shirt,Licensed Steel Chair,Quis itaque delectus inventore quisquam praesentium ipsum magnam excepturi accusamus.,133.35,https://loremflickr.com/640/480/fashion?lock=6141981193404416,male,false,,,,,,,,,,,,,,,,,,,,,,,
64d45cd5bcde2e72091113b2,shoes,Fantastic Fresh Chair,Quo officiis alias doloribus laudantium nemo animi. Sit cum dignissimos fuga aliquid dignissimos.,192.27,https://loremflickr.com/640/480/fashion?lock=2409323093295104,male,false,,,,,,,,,,,,,,,,,,,,,,,
64d45cd5bcde2e72091113b3,shoes,Electronic Bronze Soap,Est nesciunt soluta.,155.02,https://loremflickr.com/640/480/fashion?lock=1518529348108288,male,false,,,,,,,,,,,,,,,,,,,,,,,
64d45cd5bcde2e72091113b4,shoes,Licensed Cotton Salad,Labore nisi pariatur quia quo incidunt saepe.,172.7,https://loremflickr.com/640/480/fashion?lock=8895085586415616,female,false,,,,,,,,,,,,,,,,,,,,,,,
64d45cd5bcde2e72091113b5,pants,Handcrafted Concrete Pants,Vero nihil soluta dolor blanditiis. Consectetur dolore nam.,190.32,https://loremflickr.com/640/480/fashion?lock=6372152487968768,male,false,,,,,,,,,,,,,,,,,,,,,,,
64d45cd5bcde2e72091113b6,pants,Small Steel Pants,Amet doloribus tenetur in natus qui cum sequi soluta. Voluptates animi atque quaerat at eum aspernatur nam labore sapiente.,104.15,https://loremflickr.com/640/480/fashion?lock=24326940131328,female,false,,,,,,,,,,,,,,,,,,,,,,,
64d45cd5bcde2e72091113b7,shirt,Handmade Soft Car,Earum laboriosam ullam praesentium totam.,144.23,https://loremflickr.com/640/480/fashion?lock=140322900279296,male,false,,,,,,,,,,,,,,,,,,,,,,,
64d45cd5bcde2e72091113b8,pants,Fantastic Rubber Shoes,Inventore cupiditate voluptatum voluptatibus beatae nesciunt aperiam alias accusantium. Non perferendis quidem quia maxime amet voluptas culpa sapiente.,110.74,https://loremflickr.com/640/480/fashion?lock=5953192667906048,female,false,,,,,,,,,,,,,,,,,,,,,,,
64d45cd5bcde2e72091113b9,pants,Generic Bronze Sausages,Ducimus placeat porro consectetur rem. Quasi incidunt blanditiis.,121.22,https://loremflickr.com/640/480/fashion?lock=3437375514476544,female,false,,,,,,,,,,,,,,,,,,,,,,,
64d45cd5bcde2e72091113ba,pants,Unbranded Soft Sausages,Similique sint eaque maiores sint dolor perspiciatis nemo quibusdam. Fugit ullam nam ipsam. Repellat harum iure nihil.,144.78,https://loremflickr.com/640/480/fashion?lock=4762843431829504,female,false,,,,,,,,,,,,,,,,,,,,,,,
64d45cd5bcde2e72091113bb,pants,Recycled Wooden Chicken,Quisquam id vitae nemo. Excepturi nam iusto.,157.41,https://loremflickr.com/640/480/fashion?lock=2195186654380032,female,false,,,,,,,,,,,,,,,,,,,,,,,
64d45cd5bcde2e72091113bc,shirt,Oriental Frozen Ball,Earum optio aut officia doloremque. Ea porro inventore. Tempore commodi alias.,108.97,https://loremflickr.com/640/480/fashion?lock=8339718875906048,female,false,,,,,,,,,,,,,,,,,,,,,,,
64d45cd5bcde2e72091113bd,shirt,Refined Fresh Chips,Magni tenetur rem quisquam aut soluta consectetur consequuntur est. Maiores nesciunt ea a neque nisi doloribus dicta aliquam vel. Esse quos quidem odit laudantium quos.,131.46,https://loremflickr.com/640/480/fashion?lock=2314372145741824,male,false,,,,,,,,,,,,,,,,,,,,,,,
64d45cd5bcde2e72091113be,shoes,Licensed Rubber Tuna,Corrupti aut enim porro praesentium quidem autem nostrum earum. Quod repellat distinctio ducimus ea facere ducimus.,160.38,https://loremflickr.com/640/480/fashion?lock=8431733678538752,male,false,,,,,,,,,,,,,,,,,,,,,,,
64d45cd5bcde2e72091113bf,shirt,Intelligent Bronze Table,Nemo distinctio fugiat natus corporis minima. Iure ut deserunt temporibus provident quaerat.,193.56,https://loremflickr.com/640/480/fashion?lock=8879442396971008,female,false,,,,,,,,,,,,,,,,,,,,,,,
64d45cd5bcde2e72091113c0,pants,Awesome Rubber Ball,Placeat praesentium reiciendis odit maxime eius voluptate.,170.33,https://loremflickr.com/640/480/fashion?lock=5892798995759104,male,false,,,,,,,,,,,,,,,,,,,,,,,
64d45cd5bcde2e72091113c1,pants,Small Fresh Table,Magni culpa assumenda rerum perferendis quasi. Dignissimos consequatur error velit ea consequatur iste laboriosam temporibus ut.,153.05,https://loremflickr.com/640/480/fashion?lock=5861805536575488,female,false,,,,,,,,,,,,,,,,,,,,,,,
64d45cd5bcde2e72091113c2,shoes,Practical Rubber Bacon,Repudiandae enim facilis saepe qui nostrum doloremque vitae tempora neque.,106.32,https://loremflickr.com/640/480/fashion?lock=806835244236800,female,false,,,,,,,,,,,,,,,,,,,,,,,
64d45cd5bcde2e72091113c3,pants,Handcrafted Metal Chair,Sit quasi quae in. Provident ea beatae cupiditate nostrum dicta ad quibusdam eum officia.,170.64,https://loremflickr.com/640/480/fashion?lock=3341379210051584,female,false,,,,,,,,,,,,,,,,,,,,,,,
64d45cd5bcde2e72091113c4,shoes,Fantastic Steel Bike,Rerum reiciendis repellendus ipsam deserunt. Commodi vero repellendus a libero maxime nobis voluptatum. Fuga nihil sint nihil ex omnis.,103.79,https://loremflickr.com/640/480/fashion?lock=4324850449514496,male,false,,,,,,,,,,,,,,,,,,,,,,,
64d45cd5bcde2e72091113c5,pants,Incredible Frozen Car,Vero repellat consectetur quisquam aperiam dolorum quia sit ipsam. Quis quidem ea accusamus qui veniam nesciunt esse excepturi enim. Mollitia fugit doloremque tempore consequatur eius asperiores vero sapiente.,129.66,https://loremflickr.com/640/480/fashion?lock=1448670146854912,female,false,,,,,,,,,,,,,,,,,,,,,,,
64d45cd5bcde2e72091113c6,shoes,Oriental Steel Soap,Illum placeat et temporibus. Tenetur ut voluptatum dolorum beatae numquam blanditiis odit dicta. Assumenda reprehenderit labore laborum blanditiis a expedita.,135.53,https://loremflickr.com/640/480/fashion?lock=4680571632484352,male,false,,,,,,,,,,,,,,,,,,,,,,,
64d45cd5bcde2e72091113c7,pants,Intelligent Wooden Tuna,Illum alias quam aut cupiditate iste dolore dolorem quisquam vel.,140.3,https://loremflickr.com/640/480/fashion?lock=8003667762348032,male,false,,,,,,,,,,,,,,,,,,,,,,,
64d45cd5bcde2e72091113c8,shoes,Practical Steel Fish,Doloremque repellendus quis.,136.61,https://loremflickr.com/640/480/fashion?lock=6026315704565760,female,false,,,,,,,,,,,,,,,,,,,,,,,
64d45cd5bcde2e72091113c9,pants,Fantastic Steel Fish,Quisquam assumenda optio tempora quaerat nobis voluptas.,153.04,https://loremflickr.com/640/480/fashion?lock=889865354870784,male,false,,,,,,,,,,,,,,,,,,,,,,,
64d45cd5bcde2e72091113ca,shoes,Bespoke Rubber Keyboard,Consequatur consequuntur sit. Beatae fugit similique odit doloribus voluptatibus placeat saepe. Similique fugit autem odio laudantium.,188.29,https://loremflickr.com/640/480/fashion?lock=2432955901280256,male,false,,,,,,,,,,,,,,,,,,,,,,,
64d45cd5bcde2e72091113cb,pants,Gorgeous Frozen Fish,Praesentium dolorum hic corrupti nam aperiam.,186.44,https://loremflickr.com/640/480/fashion?lock=2320883360202752,male,false,,,,,,,,,,,,,,,,,,,,,,,
64d45cd5bcde2e72091113cc,shirt,Luxurious Frozen Pants,Tenetur minima eligendi ex minus accusamus magni officia nihil excepturi. Odit aliquid rerum delectus debitis eos ipsa aspernatur. Odio molestiae labore alias aliquid deleniti sit numquam.,114.61,https://loremflickr.com/640/480/fashion?lock=6496868819271680,male,false,,,,,,,,,,,,,,,,,,,,,,,
64d45cd5bcde2e72091113cd,pants,Incredible Bronze Mouse,Saepe earum id. Accusantium ipsam non illum temporibus nulla perferendis ratione atque. Qui ea quo.,195.74,https://loremflickr.com/640/480/fashion?lock=6411262535663616,male,false,,,,,,,,,,,,,,,,,,,,,,,
64d45cd5bcde2e72091113ce,shirt,Luxurious Concrete Tuna,Laudantium sint necessitatibus voluptas.,176.59,https://loremflickr.com/640/480/fashion?lock=7602767979872256,male,false,,,,,,,,,,,,,,,,,,,,,,,
64d45cd5bcde2e72091113cf,shirt,Sleek Granite Hat,Dolorem et nisi occaecati molestiae culpa accusantium sit distinctio. Quos aut repellat fuga non voluptatem.,131.44,https://loremflickr.com/640/480/fashion?lock=1575685063704576,male,false,,,,,,,,,,,,,,,,,,,,,,,
64d45cd5bcde2e72091113d0,pants,Gorgeous Granite Shirt,Architecto sapiente illo tempora perspiciatis minus eligendi.,165.21,https://loremflickr.com/640/480/fashion?lock=5063641091014656,female,false,,,,,,,,,,,,,,,,,,,,,,,
64d45cd5bcde2e72091113d1,shoes,Unbranded Steel Shirt,Modi nesciunt tempore quisquam nemo natus fugiat provident deleniti. Quas magni officiis non deserunt incidunt fugit dolores veritatis. Quasi exercitationem officiis facilis nobis harum dolorum quisquam minus.,112.26,https://loremflickr.com/640/480/fashion?lock=2049832260730880,male,false,,,,,,,,,,,,,,,,,,,,,,,
64d45cd5bcde2e72091113d2,shoes,Sleek Fresh Cheese,Rem atque voluptatibus pariatur ducimus rerum alias ex quia. Optio sapiente repellendus. Nemo molestiae modi hic harum.,103.94,https://loremflickr.com/640/480/fashion?lock=556029106454528,female,false,,,,,,,,,,,,,,,,,,,,,,,
64d45cd5bcde2e72091113d3,shoes,Electronic Metal Computer,Consequuntur consequatur consequuntur in corporis qui iste temporibus quis.,169.04,https://loremflickr.com/640/480/fashion?lock=1135514121928704,female,false,,,,,,,,,,,,,,,,,,,,,,,
64d45cd5bcde2e72091113d4,pants,Refined Plastic Table,Omnis ipsam atque at eveniet velit explicabo est nisi. Sint alias dolorem alias veritatis vero quis aut id dolores. Facilis odio hic porro.,105.33,https://loremflickr.com/640/480/fashion?lock=4008953046368256,female,false,,,,,,,,,,,,,,,,,,,,,,,
64d45cd5bcde2e72091113d5,shirt,Handcrafted Concrete Car,Impedit corporis veritatis adipisci.,145.75,https://loremflickr.com/640/480/fashion?lock=57361926455296,male,false,,,,,,,,,,,,,,,,,,,,,,,
64d45cd5bcde2e72091113d6,shirt,Electronic Steel Shoes,Qui rerum harum expedita quos tempore. Doloribus consequuntur sunt saepe quos quaerat voluptatibus dolorem.,123.23,https://loremflickr.com/640/480/fashion?lock=4739561357836288,female,false,,,,,,,,,,,,,,,,,,,,,,,
64d45cd5bcde2e72091113d7,pants,Ergonomic Cotton Salad,Officia quos maxime velit placeat magnam earum quasi. Minima neque libero cupiditate magni dolore tenetur sed. Consequatur dolorum voluptates excepturi aspernatur veritatis.,188.86,https://loremflickr.com/640/480/fashion?lock=2946311261257728,female,false,,,,,,,,,,,,,,,,,,,,,,,
64d45cd5bcde2e72091113d8,pants,Gorgeous Bronze Pants,Atque soluta cupiditate rem exercitationem dicta. Iusto tenetur impedit vero. Consectetur optio itaque necessitatibus.,110.73,https://loremflickr.com/640/480/fashion?lock=5663655200817152,female,false,,,,,,,,,,,,,,,,,,,,,,,
64d45cd5bcde2e72091113d9,shirt,Recycled Wooden Gloves,Exercitationem perferendis doloribus voluptas doloremque est.,197.56,https://loremflickr.com/640/480/fashion?lock=7770955128504320,female,false,,,,,,,,,,,,,,,,,,,,,,,
