_id,category,name,description,price,image,gender,isDeleted,updatedAt,createdAt,__v,image.asset_id,image.public_id,image.version,image.version_id,image.signature,image.width,image.height,image.format,image.resource_type,image.created_at,image.bytes,image.type,image.etag,image.placeholder,image.url,image.secure_url,image.folder,image.access_mode,image.original_filename,image.api_key
64d45cd5bcde2e7209111315,shoes,Awesome Frozen Keyboard,Aliquam blanditiis harum illum delectus enim. Maxime ex laborum nostrum placeat dolorum id earum non. Reprehenderit cupiditate quod aperiam.,137.29,https://loremflickr.com/640/480/fashion?lock=44436796997632,male,true,2023-08-11T02:57:08.154Z,,,,,,,,,,,,,,,,,,,,,,
64d45cd5bcde2e7209111316,pants,Awesome Metal Towel,Labore tempore nisi aut. Exercitationem distinctio aliquam quo.,133.41,https://loremflickr.com/640/480/fashion?lock=2802252645400576,male,true,2023-08-12T00:21:50.218Z,,,,,,,,,,,,,,,,,,,,,,
64d45cd5bcde2e7209111317,shoes,Handcrafted Concrete Car,Consectetur nisi iure ipsa veritatis amet repudiandae nihil. Dolores doloremque quae accusamus rem. Sunt eum et tenetur perferendis quo voluptates nisi.,104.09,https://loremflickr.com/640/480/fashion?lock=4685123794501632,male,true,2023-08-12T22:06:29.602Z,,,,,,,,,,,,,,,,,,,,,,
64d45cd5bcde2e7209111318,pants,Handcrafted Cotton Chip,Rem aperiam sunt ratione officiis hic libero vitae. Delectus esse eveniet incidunt esse fuga ex reiciendis. Illo quas fugit ducimus.,106.34,,male,true,2023-08-13T17:40:33.903Z,,,,,,,,,,,,,,,,,,,,,,
64d45cd5bcde2e7209111319,shirt,Small Granite Towels,Assumenda et sapiente maxime facere voluptate dolor. Corrupti quod atque consectetur. Ipsam possimus quo architecto dicta ad aperiam.,165.93,https://loremflickr.com/640/480/fashion?lock=280975370092544,female,false,,,,,,,,,,,,,,,,,,,,,,,
64d45cd5bcde2e720911131a,shoes,Luxurious Wooden Cheese,Tempore eos hic numquam. Nisi libero assumenda quibusdam architecto eligendi harum voluptate facere commodi.,195.3,https://loremflickr.com/640/480/fashion?lock=3338793348235264,female,true,2023-08-14T09:17:35.994Z,,,,,,,,,,,,,,,,,,,,,,
64d45cd5bcde2e720911131b,pants,Bespoke Soft Pants,Nisi dolore recusandae veritatis quasi impedit reiciendis possimus maxime ratione.,151.89,https://loremflickr.com/640/480/fashion?lock=7637369570197504,female,false,,,,,,,,,,,,,,,,,,,,,,,
64d45cd5bcde2e720911131c,shoes,Unbranded Concrete Table,Ab ullam voluptate a dolores animi explicabo. Similique dignissimos eveniet.,145.56,https://loremflickr.com/640/480/fashion?lock=6618893674086400,male,false,,,,,,,,,,,,,,,,,,,,,,,
64d45cd5bcde2e720911131d,pants,Modern Plastic Bike,Corporis maxime dolorem nihil. Quisquam reiciendis ducimus repudiandae inventore pariatur velit qui. Corrupti aperiam nesciunt modi ea architecto deserunt reiciendis maiores.,184.53,https://loremflickr.com/640/480/fashion?lock=4299835532378112,male,false,,,,,,,,,,,,,,,,,,,,,,,
64d45cd5bcde2e720911131e,pants,Awesome Cotton Salad,A veritatis debitis. Commodi eaque rerum deserunt libero veniam facere beatae illo deserunt.,160.28,https://res.cloudinary.com/dr4uslxhx/image/upload/v1691945959/nrexnq4m1end2wmbnbbe.jpg,female,false,2023-08-13T16:59:19.586Z,,,,,,,,,,,,,,,,,,,,,,
64d45cd5bcde2e720911131f,shirt,Handcrafted Cotton Soap,Distinctio ut optio voluptatum laudantium harum.,102.56,https://loremflickr.com/640/480/fashion?lock=357707137679360,female,false,,,,,,,,,,,,,,,,,,,,,,,
64d45cd5bcde2e7209111320,shoes,Sleek Granite Keyboard,Culpa eum similique error ex saepe enim natus. Odio corporis nesciunt.,160.16,,male,false,2023-08-13T17:31:41.876Z,,,,,,,,,,,,,,,,,,,,,,
64d45cd5bcde2e7209111321,shoes,Small Fresh Mouse,Corporis fugit suscipit et vero eum exercitationem deserunt ullam. Laborum dignissimos similique quas delectus dolore placeat. Molestias maxime nesciunt reiciendis architecto.,174.19,https://loremflickr.com/640/480/fashion?lock=1537616107274240,male,false,2023-08-13T16:42:05.061Z,,,,,,,,,,,,,,,,,,,,,,
64d45cd5bcde2e7209111322,shirt,Recycled Soft Sausages,Illum consequatur distinctio nesciunt vitae necessitatibus aut libero. Voluptates maiores aliquam nobis nesciunt at.,148.65,https://loremflickr.com/640/480/fashion?lock=5739275735793664,male,false,,,,,,,,,,,,,,,,,,,,,,,
64d45cd5bcde2e7209111323,pants,Gorgeous Concrete Bike,Sunt adipisci animi nulla deleniti unde ullam maiores voluptatem. Vero provident rerum tempore non quibusdam.,152.91,https://res.cloudinary.com/dr4uslxhx/image/upload/v1692004670/rrlsfwk4gqzkxy2hih2i.jpg,female,false,2023-08-14T09:17:51.951Z,,,,,,,,,,,,,,,,,,,,,,
64d45cd5bcde2e7209111324,shirt,Handmade Cotton Chicken,Fugiat exercitationem aliquam voluptatum harum.,110.05,https://loremflickr.com/640/480/fashion?lock=7590823759708160,male,false,,,,,,,,,,,,,,,,,,,,,,,
64d45cd5bcde2e7209111325,shoes,Small Concrete Chair,Quod voluptatem impedit nihil nobis rerum cupiditate praesentium animi.,159.06,https://loremflickr.com/640/480/fashion?lock=1480455958298624,female,false,,,,,,,,,,,,,,,,,,,,,,,
64d45cd5bcde2e7209111326,pants,Generic Fresh Bacon,Velit animi cum. Pariatur porro incidunt nostrum at exercitationem dolor non quasi cumque. Laborum ut molestiae rem ab doloribus recusandae corrupti recusandae rerum.,163.69,https://loremflickr.com/640/480/fashion?lock=4296061982081024,male,false,,,,,,,,,,,,,,,,,,,,,,,
64d45cd5bcde2e7209111327,shirt,Sleek Rubber Pizza,Quibusdam rerum minus mollitia atque nobis sapiente.,149.29,https://loremflickr.com/640/480/fashion?lock=1692696565514240,female,false,,,,,,,,,,,,,,,,,,,,,,,
64d45cd5bcde2e7209111328,shoes,Bespoke Metal Chips,Neque illum nulla ipsum labore saepe nostrum. Quasi inventore fuga modi ipsam illo voluptatem repudiandae.,159.08,https://loremflickr.com/640/480/fashion?lock=4931914693607424,male,false,,,,,,,,,,,,,,,,,,,,,,,
64d45cd5bcde2e7209111329,shirt,Fantastic Steel Ball,Nemo cum vitae. Dolorem autem fugiat ullam et dolorum dicta quo.,140.87,https://loremflickr.com/640/480/fashion?lock=3049009553866752,female,false,,,,,,,,,,,,,,,,,,,,,,,
64d45cd5bcde2e720911132a,shirt,Handcrafted Wooden Keyboard,Error sit impedit earum magnam quibusdam numquam nesciunt eveniet. Similique vitae culpa a nulla quos quis magnam.,166.06,https://loremflickr.com/640/480/fashion?lock=4188001240350720,female,false,,,,,,,,,,,,,,,,,,,,,,,
64d45cd5bcde2e720911132b,shoes,Rustic Cotton Fish,Nobis repellat quam odio.,157.24,https://loremflickr.com/640/480/fashion?lock=4383065319145472,female,false,,,,,,,,,,,,,,,,,,,,,,,
64d45cd5bcde2e720911132c,pants,Fantastic Plastic Hat,Praesentium pariatur praesentium ab ratione sint rerum qui sequi nulla. Laudantium libero adipisci porro. Earum nam adipisci eaque placeat laboriosam sit temporibus.,117.86,https://loremflickr.com/640/480/fashion?lock=4849890507096064,female,false,,,,,,,,,,,,,,,,,,,,,,,
64d45cd5bcde2e720911132d,shirt,Recycled Concrete Table,Totam excepturi adipisci qui quibusdam odio modi eum. Deserunt minus sequi earum cumque maxime dolore consequuntur. Ipsum voluptatem quaerat provident.,158.66,https://loremflickr.com/640/480/fashion?lock=8245642912595968,female,false,,,,,,,,,,,,,,,,,,,,,,,
64d45cd5bcde2e720911132e,shirt,Rustic Frozen Soap,Molestiae magni possimus maxime porro natus. Doloremque quisquam ut ab illo quia natus itaque.,169.97,https://loremflickr.com/640/480/fashion?lock=2143202331066368,male,false,,,,,,,,,,,,,,,,,,,,,,,
64d45cd5bcde2e720911132f,pants,Handcrafted Frozen Shoes,Dicta deleniti sint sunt repellat tenetur laudantium ratione. Maiores incidunt qui architecto recusandae suscipit ex rem ducimus. Itaque molestiae eveniet.,139.93,https://loremflickr.com/640/480/fashion?lock=5737139786481664,male,false,,,,,,,,,,,,,,,,,,,,,,,
64d45cd5bcde2e7209111330,shoes,Small Cotton Chicken,Voluptatem nesciunt amet porro ut amet consequuntur odit.,105.24,https://loremflickr.com/640/480/fashion?lock=7993232495476736,male,false,,,,,,,,,,,,,,,,,,,,,,,
64d45cd5bcde2e7209111331,pants,Recycled Metal Ball,Aliquam veniam fugit sint accusamus non non possimus. Corporis aliquam culpa possimus.,189.54,https://loremflickr.com/640/480/fashion?lock=2376590421917696,female,false,,,,,,,,,,,,,,,,,,,,,,,
64d45cd5bcde2e7209111332,pants,Elegant Granite Tuna,Numquam fuga neque consectetur. Earum reprehenderit nostrum sunt quisquam.,110.94,https://loremflickr.com/640/480/fashion?lock=3578853119229952,female,false,,,,,,,,,,,,,,,,,,,,,,,
64d45cd5bcde2e7209111333,pants,Tasty Cotton Fish,Delectus repellat esse vero exercitationem tenetur voluptatum similique.,165.82,https://loremflickr.com/640/480/fashion?lock=1386505549381632,female,false,,,,,,,,,,,,,,,,,,,,,,,
64d45cd5bcde2e7209111334,pants,Elegant Frozen Keyboard,Quo dignissimos porro ea nobis laborum exercitationem.,116.06,https://loremflickr.com/640/480/fashion?lock=8216183249567744,male,false,,,,,,,,,,,,,,,,,,,,,,,
64d45cd5bcde2e7209111335,pants,Awesome Soft Mouse,Dignissimos dolorum commodi.,127.44,https://loremflickr.com/640/480/fashion?lock=8411699409321984,male,false,,,,,,,,,,,,,,,,,,,,,,,
64d45cd5bcde2e7209111336,pants,Awesome Metal Salad,Pariatur occaecati nobis. Illum porro fugiat praesentium voluptatum voluptatibus autem ipsam consequuntur corrupti. Eius voluptates sit veniam beatae molestiae ex.,122.99,https://loremflickr.com/640/480/fashion?lock=6656203599904768,female,false,,,,,,,,,,,,,,,,,,,,,,,
64d45cd5bcde2e7209111337,pants,Rustic Steel Keyboard,Rem delectus voluptas atque eveniet alias. Quos dolore inventore iste adipisci quos. Magni magni nobis ullam illo ea quidem.,119.98,https://loremflickr.com/640/480/fashion?lock=7200812499468288,female,false,,,,,,,,,,,,,,,,,,,,,,,
64d45cd5bcde2e7209111338,shirt,Unbranded Wooden Shirt,Voluptatibus rerum voluptate sint dolor delectus quo. Esse id eum cumque quam veritatis architecto iure facere ullam.,172.02,https://loremflickr.com/640/480/fashion?lock=7617939006029824,male,false,,,,,,,,,,,,,,,,,,,,,,,
64d45cd5bcde2e7209111339,shirt,Ergonomic Rubber Pizza,Reiciendis blanditiis sequi illo autem reiciendis omnis nulla rerum corrupti.,181.05,https://loremflickr.com/640/480/fashion?lock=6993579369037824,male,false,,,,,,,,,,,,,,,,,,,,,,,
64d45cd5bcde2e720911133a,pants,Handcrafted Wooden Fish,Nesciunt debitis a enim cum. Cumque tenetur quia assumenda commodi architecto animi illo commodi omnis. Expedita nesciunt illum ipsum impedit perspiciatis placeat tempora et libero.,140.65,https://loremflickr.com/640/480/fashion?lock=6046876663021568,female,false,,,,,,,,,,,,,,,,,,,,,,,
64d45cd5bcde2e720911133b,shoes,Electronic Cotton Tuna,Praesentium provident ad repellat possimus fugiat est. Sit vero non ex cumque numquam illo voluptates dolorem.,189.15,https://loremflickr.com/640/480/fashion?lock=7582947049734144,female,false,,,,,,,,,,,,,,,,,,,,,,,
64d45cd5bcde2e720911133c,pants,Rustic Metal Keyboard,Commodi voluptatum harum.,162.54,https://loremflickr.com/640/480/fashion?lock=5247276523978752,female,false,,,,,,,,,,,,,,,,,,,,,,,
64d45cd5bcde2e720911133d,shirt,Small Cotton Salad,Odio saepe eos quis assumenda odit vero. Itaque pariatur voluptate. Quis eius harum consequuntur quia quae hic suscipit nobis nihil.,158.7,https://loremflickr.com/640/480/fashion?lock=1434471593148416,female,false,,,,,,,,,,,,,,,,,,,,,,,
64d45cd5bcde2e720911133e,pants,Awesome Rubber Bike,Enim placeat amet soluta.,141.15,https://loremflickr.com/640/480/fashion?lock=1916034755854336,female,false,,,,,,,,,,,,,,,,,,,,,,,
64d45cd5bcde2e720911133f,pants,Refined Plastic Hat,Beatae veniam exercitationem.,136.98,https://loremflickr.com/640/480/fashion?lock=8034193952997376,male,false,,,,,,,,,,,,,,,,,,,,,,,
64d45cd5bcde2e7209111340,pants,Oriental Granite Pizza,Dolor eum assumenda odit alias soluta. Sed aspernatur odio voluptatem impedit cupiditate nulla eum.,190.34,https://loremflickr.com/640/480/fashion?lock=4305170406047744,female,false,,,,,,,,,,,,,,,,,,,,,,,
64d45cd5bcde2e7209111341,pants,Intelligent Frozen Pants,Dolores quas tenetur perferendis rerum nesciunt architecto amet provident. Laboriosam consequatur ab unde ipsum quidem perferendis iste iusto. Quod omnis molestias repudiandae.,116.12,https://loremflickr.com/640/480/fashion?lock=8795152613113856,female,false,,,,,,,,,,,,,,,,,,,,,,,
64d45cd5bcde2e7209111342,shirt,Unbranded Granite Cheese,Sequi facilis dicta provident dignissimos placeat odio atque illo expedita. Enim rem doloremque. Dignissimos perspiciatis fugiat natus velit doloribus ad dolor neque harum.,172.9,https://loremflickr.com/640/480/fashion?lock=8181405297147904,female,false,,,,,,,,,,,,,,,,,,,,,,,
64d45cd5bcde2e7209111343,pants,Small Granite Pizza,Nemo eius quae officia maxime cum voluptatem commodi dolor sed. Saepe nemo deserunt in quas veniam dicta magni ad veritatis.,170.17,https://loremflickr.com/640/480/fashion?lock=8130605273317376,male,false,,,,,,,,,,,,,,,,,,,,,,,
64d45cd5bcde2e7209111344,pants,Fantastic Concrete Fish,Minima quasi necessitatibus veniam cupiditate.,137.35,https://loremflickr.com/640/480/fashion?lock=2797894499303424,male,false,,,,,,,,,,,,,,,,,,,,,,,
64d45cd5bcde2e7209111345,pants,Electronic Granite Bike,Soluta quam impedit iusto veritatis praesentium iste. Occaecati facilis perferendis voluptate impedit consequuntur.,185.82,https://loremflickr.com/640/480/fashion?lock=588771464577024,male,false,,,,,,,,,,,,,,,,,,,,,,,
64d45cd5bcde2e7209111346,shoes,Generic Steel Chicken,Autem molestiae numquam error. Expedita harum aut iure maxime aspernatur voluptatem odio iusto optio.,165.41,https://loremflickr.com/640/480/fashion?lock=5145448905965568,female,false,,,,,,,,,,,,,,,,,,,,,,,
64d45cd5bcde2e7209111347,pants,Elegant Plastic Tuna,Nihil aspernatur praesentium porro accusamus consequatur sapiente quae eius dicta. Aspernatur dignissimos corporis occaecati maxime placeat.,181.05,https://loremflickr.com/640/480/fashion?lock=1051064948228096,male,false,,,,,,,,,,,,,,,,,,,,,,,
64d45cd5bcde2e7209111348,pants,Awesome Wooden Soap,Amet ullam nam illum nihil consequatur sit quidem sunt nobis.,139.09,https://loremflickr.com/640/480/fashion?lock=4457266784763904,female,false,,,,,,,,,,,,,,,,,,,,,,,
64d45cd5bcde2e7209111349,shoes,Rustic Fresh Ball,Amet minima nam ullam debitis iusto laborum earum atque. Occaecati aliquid consectetur.,151.83,https://loremflickr.com/640/480/fashion?lock=6353430243180544,male,false,,,,,,,,,,,,,,,,,,,,,,,
64d45cd5bcde2e720911134a,shoes,Licensed Fresh Shoes,Recusandae cumque sit labore eaque adipisci sint dolor accusamus possimus. Reiciendis dolores accusantium ab fuga occaecati et. Iusto doloremque occaecati maxime numquam.,170.44,https://loremflickr.com/640/480/fashion?lock=3176650478977024,female,false,,,,,,,,,,,,,,,,,,,,,,,
64d45cd5bcde2e720911134b,shirt,Bespoke Concrete Ball,Facilis enim cum nulla dignissimos veritatis labore tempore ab porro. Aspernatur architecto deleniti recusandae earum animi nihil dolorem accusamus. Doloremque corporis veniam quos dolorem nam aliquam.,133.36,https://loremflickr.com/640/480/fashion?lock=6172707324428288,male,false,,,,,,,,,,,,,,,,,,,,,,,
64d45cd5bcde2e720911134c,shirt,Handcrafted Cotton Table,Eaque natus doloribus magnam debitis quis nobis. Alias nulla sint. Consequuntur delectus autem perspiciatis tempora architecto quam.,106.18,https://loremflickr.com/640/480/fashion?lock=2953671090372608,female,false,,,,,,,,,,,,,,,,,,,,,,,
64d45cd5bcde2e720911134d,pants,Sleek Metal Keyboard,Debitis facilis quos. Expedita nam quo voluptates incidunt libero officiis illo sit pariatur.,193.95,https://loremflickr.com/640/480/fashion?lock=6865778720636928,female,false,,,,,,,,,,,,,,,,,,,,,,,
64d45cd5bcde2e720911134e,shirt,Oriental Rubber Shoes,Nemo officiis dignissimos debitis repudiandae illo placeat quae consequuntur. Adipisci rem vitae excepturi libero rem. Corrupti tempora tempora nihil itaque aspernatur repellendus qui dolorem.,132.36,https://loremflickr.com/640/480/fashion?lock=1961916429762560,female,false,,,,,,,,,,,,,,,,,,,,,,,
64d45cd5bcde2e720911134f,shirt,Bespoke Frozen Chips,Iusto expedita est suscipit. A ut inventore architecto eum beatae natus vel.,143.59,https://loremflickr.com/640/480/fashion?lock=8350060616089600,male,false,,,,,,,,,,,,,,,,,,,,,,,
64d45cd5bcde2e7209111350,shoes,Practical Fresh Pants,Cum est incidunt voluptatum aspernatur neque maxime reiciendis ipsum ea. Doloribus quia nemo adipisci facilis ab accusamus.,146.64,https://loremflickr.com/640/480/fashion?lock=2963457534066688,male,false,,,,,,,,,,,,,,,,,,,,,,,
64d45cd5bcde2e7209111351,shoes,Luxurious Steel Ball,Voluptates dolorem pariatur. Ipsa exercitationem beatae amet.,190.42,https://loremflickr.com/640/480/fashion?lock=5650246998687744,male,false,,,,,,,,,,,,,,,,,,,,,,,
64d45cd5bcde2e7209111352,pants,Oriental Wooden Car,Ipsum soluta in fuga temporibus unde vel. Omnis ipsa vel nobis dolorem alias provident quia.,172.48,https://loremflickr.com/640/480/fashion?lock=8062829600964608,female,false,,,,,,,,,,,,,,,,,,,,,,,
64d45cd5bcde2e7209111353,shirt,Practical Concrete Table,Dolor aspernatur id distinctio quae veritatis id sint ratione. Accusantium suscipit corporis non nihil quidem. Pariatur provident aliquam facere iure quae.,119.36,https://loremflickr.com/640/480/fashion?lock=4133308883533824,female,false,,,,,,,,,,,,,,,,,,,,,,,
64d45cd5bcde2e7209111354,shoes,Fantastic Soft Salad,Pariatur impedit sapiente. Sequi ipsam corrupti iure alias eius error enim magni minus. Architecto voluptate adipisci corporis modi veritatis ea aspernatur animi.,111.06,https://loremflickr.com/640/480/fashion?lock=320771884843008,male,false,,,,,,,,,,,,,,,,,,,,,,,
64d45cd5bcde2e7209111355,shirt,Tasty Soft Chips,Nisi natus id aliquam quidem aspernatur ipsa. Nihil sed ducimus doloribus id. Vitae aspernatur est labore fugit similique.,105.93,https://loremflickr.com/640/480/fashion?lock=3095751009763328,female,false,,,,,,,,,,,,,,,,,,,,,,,
64d45cd5bcde2e7209111356,pants,Gorgeous Concrete Fish,Ipsam nobis temporibus. Alias non assumenda asperiores.,168.14,https://loremflickr.com/640/480/fashion?lock=5733772261588992,male,false,,,,,,,,,,,,,,,,,,,,,,,
64d45cd5bcde2e7209111357,shirt,Handmade Wooden Chips,Perspiciatis rem nesciunt rem provident ipsum ex quidem assumenda.,126.64,https://loremflickr.com/640/480/fashion?lock=8785404509552640,male,false,,,,,,,,,,,,,,,,,,,,,,,
64d45cd5bcde2e7209111358,shirt,Handmade Granite Tuna,Ratione quibusdam quibusdam modi.,111.93,https://loremflickr.com/640/480/fashion?lock=1213186667708416,male,false,,,,,,,,,,,,,,,,,,,,,,,
64d45cd5bcde2e7209111359,pants,Awesome Rubber Mouse,Nesciunt saepe consectetur inventore reiciendis doloremque ex aspernatur magni. Minus eaque natus animi. Magni perferendis delectus atque nisi beatae inventore unde.,177.49,https://loremflickr.com/640/480/fashion?lock=2208053736767488,male,false,,,,,,,,,,,,,,,,,,,,,,,
64d45cd5bcde2e720911135a,shirt,Incredible Frozen Computer,Ab velit odit atque ex accusamus. Accusamus doloremque dolorum quisquam iste soluta beatae voluptates voluptatibus repudiandae.,160.47,https://loremflickr.com/640/480/fashion?lock=4631158966976512,female,false,,,,,,,,,,,,,,,,,,,,,,,
64d45cd5bcde2e720911135b,shoes,Intelligent Steel Hat,Ipsam porro est laboriosam.,157.6,https://loremflickr.com/640/480/fashion?lock=7809950283726848,male,false,,,,,,,,,,,,,,,,,,,,,,,
64d45cd5bcde2e720911135c,shirt,Small Rubber Pizza,Neque saepe fuga maiores incidunt debitis aliquam qui quos. Cum quos voluptates possimus.,199.33,https://loremflickr.com/640/480/fashion?lock=4461690020167680,male,false,,,,,,,,,,,,,,,,,,,,,,,
64d45cd5bcde2e720911135d,shoes,Gorgeous Bronze Towels,Possimus omnis possimus impedit expedita vel. Quisquam doloremque libero tempore reiciendis repellendus quasi. Eum et quas.,157.56,https://loremflickr.com/640/480/fashion?lock=4031541690761216,female,false,,,,,,,,,,,,,,,,,,,,,,,
64d45cd5bcde2e720911135e,pants,Refined Soft Table,Doloribus cumque commodi doloremque deleniti soluta. Iste illum quis amet molestias nam in. Vel voluptas maxime corrupti repellendus vitae voluptate alias aspernatur.,173.51,https://loremflickr.com/640/480/fashion?lock=2609736992161792,female,false,,,,,,,,,,,,,,,,,,,,,,,
64d45cd5bcde2e720911135f,shoes,Intelligent Concrete Fish,Velit atque id cupiditate nemo architecto atque tempora impedit. Enim ea incidunt magnam voluptatem eveniet. Sed voluptates voluptatem.,117.72,https://loremflickr.com/640/480/fashion?lock=7519357955473408,male,false,,,,,,,,,,,,,,,,,,,,,,,
64d45cd5bcde2e7209111360,shoes,Intelligent Concrete Towels,Aliquid cupiditate sequi rem nisi rerum explicabo excepturi necessitatibus facere.,195.15,https://loremflickr.com/640/480/fashion?lock=2083228083027968,female,false,,,,,,,,,,,,,,,,,,,,,,,
64d45cd5bcde2e7209111361,shirt,Elegant Steel Pants,Officia placeat ab laborum neque ipsam placeat.,178.62,https://loremflickr.com/640/480/fashion?lock=870822157746176,male,false,,,,,,,,,,,,,,,,,,,,,,,
64d45cd5bcde2e7209111362,shoes,Fantastic Granite Cheese,Eos qui deleniti. Sapiente eos inventore excepturi ex voluptatibus tempora itaque aliquid.,102.92,https://loremflickr.com/640/480/fashion?lock=3190874192216064,female,false,,,,,,,,,,,,,,,,,,,,,,,
64d45cd5bcde2e7209111363,shirt,Oriental Bronze Shoes,Voluptate facilis amet accusantium minus vero odio. Voluptatem vel ad quis aliquam. Occaecati totam ipsa veritatis totam.,171.21,https://loremflickr.com/640/480/fashion?lock=2504302862008320,female,false,,,,,,,,,,,,,,,,,,,,,,,
64d45cd5bcde2e7209111364,shoes,Recycled Soft Computer,Laboriosam quidem sint commodi autem laudantium.,134.55,https://loremflickr.com/640/480/fashion?lock=8796278836166656,female,false,,,,,,,,,,,,,,,,,,,,,,,
64d45cd5bcde2e7209111365,shirt,Elegant Granite Hat,Sed asperiores iste.,164.41,https://loremflickr.com/640/480/fashion?lock=7508964124131328,male,false,,,,,,,,,,,,,,,,,,,,,,,
64d45cd5bcde2e7209111366,shoes,Unbranded Soft Pants,Mollitia et sunt provident quisquam quisquam quisquam quisquam blanditiis. Cum aliquam consectetur necessitatibus quae quod. Eius at illum.,122.46,https://loremflickr.com/640/480/fashion?lock=2078651409498112,male,false,,,,,,,,,,,,,,,,,,,,,,,
64d45cd5bcde2e7209111367,shirt,Incredible Frozen Car,Deleniti dolor aliquam.,175.91,https://loremflickr.com/640/480/fashion?lock=5091742825054208,male,false,,,,,,,,,,,,,,,,,,,,,,,
64d45cd5bcde2e7209111368,pants,Refined Wooden Car,Impedit amet eius tempore tenetur beatae voluptatum occaecati enim. Sint accusantium commodi.,116.4,https://loremflickr.com/640/480/fashion?lock=2801779045564416,female,false,,,,,,,,,,,,,,,,,,,,,,,
64d45cd5bcde2e7209111369,pants,Intelligent Fresh Tuna,Animi fuga totam alias sed aliquam voluptatem.,192.83,https://loremflickr.com/640/480/fashion?lock=2778470398558208,female,false,,,,,,,,,,,,,,,,,,,,,,,
64d45cd5bcde2e720911136a,shoes,Bespoke Bronze Computer,Blanditiis deleniti sit excepturi. Recusandae eligendi architecto facilis ipsum excepturi cum cum.,188.97,https://loremflickr.com/640/480/fashion?lock=3956188070805504,male,false,,,,,,,,,,,,,,,,,,,,,,,
64d45cd5bcde2e720911136b,shoes,Awesome Fresh Chicken,Harum aspernatur facere nemo deserunt delectus harum. Libero illo rerum nam veritatis ex perferendis. Pariatur odio voluptatum sunt iusto placeat neque pariatur aut.,166.69,https://loremflickr.com/640/480/fashion?lock=5015980734414848,male,false,,,,,,,,,,,,,,,,,,,,,,,
64d45cd5bcde2e720911136c,shirt,Rustic Bronze Bike,Temporibus fuga eius hic. Iste earum in aliquam error est unde quod non molestiae.,160.88,https://loremflickr.com/640/480/fashion?lock=6527364796252160,female,false,,,,,,,,,,,,,,,,,,,,,,,
64d45cd5bcde2e720911136d,shirt,Handmade Steel Cheese,Fuga cum in reiciendis sit magnam ex repellat alias ratione. Nemo quas doloribus corrupti omnis excepturi atque.,145.42,https://loremflickr.com/640/480/fashion?lock=4245834730307584,male,false,,,,,,,,,,,,,,,,,,,,,,,
64d45cd5bcde2e720911136e,pants,Unbranded Plastic Keyboard,Rerum molestiae dolor nobis pariatur mollitia laborum magni neque.,132.29,https://loremflickr.com/640/480/fashion?lock=8874392926814208,male,false,,,,,,,,,,,,,,,,,,,,,,,
64d45cd5bcde2e720911136f,pants,Practical Steel Pizza,Cumque maxime minima. Eius optio perspiciatis. Saepe inventore molestiae iste illum nulla necessitatibus.,197.6,https://loremflickr.com/640/480/fashion?lock=4403610179862528,female,false,,,,,,,,,,,,,,,,,,,,,,,
64d45cd5bcde2e7209111370,shoes,Electronic Rubber Computer,Vero perferendis corrupti excepturi. Maxime harum numquam.,126.15,https://loremflickr.com/640/480/fashion?lock=6227429163008000,female,false,,,,,,,,,,,,,,,,,,,,,,,
64d45cd5bcde2e7209111371,shirt,Oriental Rubber Car,Reiciendis asperiores necessitatibus incidunt. Porro quaerat quos tempora corrupti.,105.78,https://loremflickr.com/640/480/fashion?lock=1538113459453952,male,false,,,,,,,,,,,,,,,,,,,,,,,
64d45cd5bcde2e7209111372,pants,Electronic Steel Chips,Ipsa ex quod sed commodi illo nihil repellendus facere.,171.06,https://loremflickr.com/640/480/fashion?lock=5515477388361728,female,false,,,,,,,,,,,,,,,,,,,,,,,
64d45cd5bcde2e7209111373,shirt,Tasty Bronze Towels,Consectetur repudiandae officia. Quos odit dolores repellendus vitae eligendi.,137.92,https://loremflickr.com/640/480/fashion?lock=4220847910813696,male,false,,,,,,,,,,,,,,,,,,,,,,,
64d45cd5bcde2e7209111374,shoes,Tasty Bronze Salad,Harum accusantium doloremque. Earum unde praesentium ducimus quasi id adipisci nam molestiae alias.,150.73,https://loremflickr.com/640/480/fashion?lock=2434241941995520,female,false,,,,,,,,,,,,,,,,,,,,,,,
64d45cd5bcde2e7209111375,shirt,Handcrafted Bronze Towels,Fugit inventore rem maxime voluptatibus commodi iste. Eligendi qui quam aliquam alias sit eius aut commodi sequi.,143.72,https://loremflickr.com/640/480/fashion?lock=2603561668050944,female,false,,,,,,,,,,,,,,,,,,,,,,,
64d45cd5bcde2e7209111376,shoes,Handmade Plastic Cheese,Explicabo a ad suscipit ex saepe adipisci ipsa tempore. Et repellendus cum unde impedit similique. Corrupti officiis impedit.,198.97,https://loremflickr.com/640/480/fashion?lock=8596800489390080,male,false,,,,,,,,,,,,,,,,,,,,,,,
